article id,fp ratio,fp count,support,title,original keywords
fpsyg.2014.01522,0.14768683274021352,83,562,Landmark and route knowledge in children s spatial representation of a virtual environment,cognitive development;decisional landmark;individual differences;language abilities;verbal encoding;visuo-spatial encoding;virtual reality;wayfinding
fpsyg.2014.01369,0.14729950900163666,90,611,"Specificity of the bilingual advantage for memory: examining cued recall, generalization, and working memory in monolingual, bilingual, and trilingual toddlers",memory;bilingualism;infant development;deferred imitation;imitation;generalization;memory flexibility
fpsyg.2015.00968,0.14620938628158844,81,554,An integrative review of attention biases and their contribution to treatment for anxiety disorders,anxiety;fear;phobia;attention;exposure;treatment
fpsyg.2015.01687,0.14606741573033707,78,534,Development and Validation of the Computerized Family Relations Test for Children,assessment;family relations;children;CFRT;computer
fpsyg.2016.00967,0.14554794520547945,85,584,Effects of Mindfulness-Based Cognitive Therapy on Body Awareness in Patients with Chronic Pain and Comorbid Depression,mindfulness-based cognitive therapy;mindfulness meditation;interoceptive awareness;body awareness;pain catastrophizing;chronic pain;depression;mediation
fpsyg.2012.00471,0.14535901926444833,83,571,Faces in Context: A Review and Systematization of Contextual Influences on Affective Face Processing,facial expression;face perception;emotion;context;basic emotion
fpsyg.2014.00975,0.14485165794066318,83,573,Invisibility and interpretation,masking;priming;visibility;consciousness
fpsyg.2013.00325,0.14471243042671614,78,539,Examining the Presence and Determinants of Operational Momentum in Childhood,approximate calculation;non-symbolic calculation;mental number line;development;space and numbers;attention;numerical cognition
fpsyg.2013.00323,0.1446886446886447,79,546,Healthy Older Observers Show Equivalent Perceptual-Cognitive Training Benefits to Young Adults for Multiple Object Tracking,aging;perceptual-cognitive training;learning;3D-MOT;attention
fpsyg.2014.01245,0.14464285714285716,81,560,The bright side of boredom,boredom;emotion;frustration;restlessness;weariness
fpsyg.2013.00900,0.1443661971830986,82,568,A penny for your thoughts: dimensions of self-generated thought content and relationships with individual differences in emotional wellbeing,mind-wandering;autobiographical;rumination;depression;mindfulness
fpsyg.2013.00461,0.1431159420289855,79,552,Judgment of emotional information expressed by prosody and semantics in patients with unipolar depression,depression;anhedonia;emotion;semantic content;prosody
fpsyg.2015.01096,0.1426056338028169,81,568,Engagement in dance is associated with emotional competence in interplay with others,alexithymia;creative achievement;dance;embodiment;emotional competence
fpsyg.2014.00099,0.14210526315789473,81,570,Decreased electrophysiological activity represents the conscious state of emptiness in meditation,EEG;meditation;consciousness;thoughtless emptiness;decreased neural processing
fpsyg.2012.00547,0.1417910447761194,76,536,Training of Manual Actions Improves Language Understanding of Semantically Related Action Sentences,embodied cognition;conceptual-semantics;language understanding;sensory-motor system;action training
fpsyg.2014.00647,0.1407035175879397,84,597," When the going gets tough, who keeps going? Depletion sensitivity moderates the ego-depletion effect",ego-depletion;depletion sensitivity;self-control;self-control endurance;individual differences
fpsyg.2013.00030,0.14054054054054055,78,555,Object Substitution Masking in Schizophrenia: An Event-Related Potential Analysis,visual processing;schizophrenia;ERP;visual backward masking;reentrant processing
fpsyg.2015.01635,0.14010507880910683,80,571,Visual processing in reading disorders and attention-deficit/hyperactivity disorder and its contribution to basic reading ability,dyslexia;reading disability;reading disorder;ADHD;children;basic reading;visual processing;visual short-term memory
fpsyg.2015.00024,0.13964686998394862,87,623,Neural correlates of an early attentional capture by positive distractor words,emotion;positive distractors;anterior N1;word processing;event-related potentials
fpsyg.2015.00183,0.1386861313868613,76,548,Using historical accounts of harpsichord touch to empirically investigate the production and perception of dynamics on the 1788 Taskin,harpsichord;touch;dynamics;music performance;acoustics;perception
fpsyg.2015.00487,0.13851992409867173,73,527,"The developmental onset of symbolic approximation: beyond nonsymbolic representations, the language of numbers matters",numerical cognition;language;nonsymbolic approximate arithmetic;symbolic approximate arithmetic;kindergarten children;number naming system;symbolic arithmetic development;cross-cultural comparison
fpsyg.2014.00054,0.13837638376383765,75,542,Guidance of visual attention by semantic information in real-world scenes,scene understanding;semantics;attention;scene perception;real-world scenes
fpsyg.2014.00808,0.13822525597269625,81,586,Jazz improvisers' shared understanding: a case study,shared understanding;intersubjectivity;collaboration;communication;interaction;improvisation;music;jazz
fpsyg.2015.01214,0.13799283154121864,77,558,Developmental differences in relations between parent-reported executive function and unitized and non-unitized memory representations during childhood,memory;executive function;unitization;binding;development
fpsyg.2011.00389,0.13798977853492334,81,587,Multimodal Semantic Quantity Representations: Further Evidence from Korean Sign Language,finger-counting;number comparison;magnitude effect;numerical size;Arabic digits;embodiment;hand posture orientation;motor imagery
fpsyg.2015.01212,0.13793103448275862,76,551,The brain-derived neurotrophic factor (BDNF) val66met polymorphism differentially affects performance on subscales of the Wechsler Memory Scale Third Edition (WMS-III),neurogenetics;BDNF;memory;recall;recognition
fpsyg.2015.00638,0.13675213675213677,80,585,Age of second language acquisition in multilinguals has an impact on gray matter volume in language-associated brain areas,multilingualism;bilingualism;age of L2 acquisition;magnetic resonance imaging;gray matter volume
fpsyg.2014.01582,0.13612565445026178,78,573,Tracking the evolutionary origins of dog-human cooperation: the Canine Cooperation Hypothesis ,domestication;evolution;cooperation;attention;Canis lupus;Canis familiaris;tolerance
fpsyg.2014.01070,0.1360655737704918,83,610,The effect of script similarity on executive control in bilinguals,bilingualism;executive control;script;Stroop task;Simon task
fpsyg.2013.00509,0.136,68,500,The Musical Emotional Bursts : a validated set of musical affect bursts to investigate auditory affective processing,music;emotion;auditory stimuli;voices
fpsyg.2014.01019,0.13508771929824562,77,570,Using brain stimulation to disentangle neural correlates of conscious vision,NIBS;TMS;TES;tDCS;visual awareness;consciousness;NCC
fpsyg.2014.00469,0.13414634146341464,77,574,The union of narrative and executive function: different but complementary,executive function;narrative;attention;inhibition;preschool children
fpsyg.2014.00408,0.13398692810457516,82,612,Long-term memory-based control of attention in multi-step tasks requires working memory: evidence from domain-specific interference,working memory;interference;attention;long-term memory;visuospatial;verbal;learning
fpsyg.2016.00040,0.13380281690140844,76,568,Fusiform Gyrus Dysfunction is Associated with Perceptual Processing Efficiency to Emotional Faces in Adolescent Depression: A Model-Based Approach,adolescent;depression;fMRI BOLD;response time modeling;mood disorders;face processing;fusiform gyrus
fpsyg.2015.01161,0.13333333333333333,74,555,"Effect of training focused on executive functions (attention, inhibition, and working memory) in preschoolers exhibiting ADHD symptoms",ADHD;preschool children;training;executive function;attention;impulsive behavior;working memory
fpsyg.2016.00026,0.13321799307958476,77,578,Music and Dyslexia: A New Musical Training Method to Improve Reading and Related Disorders,dyslexia;music therapy;phonology;reading;attention;learning disorders
fpsyg.2015.00064,0.13257575757575757,70,528,Children with speech sound disorder: comparing a non-linguistic auditory approach with a phonological intervention approach to improve phonological skills,speech sound disorder;phonology impairment;language therapy;auditory stimulation;children
fpsyg.2015.01419,0.13240418118466898,76,574,Cueing musical emotions: An empirical analysis of 24-piece sets by Bach and Chopin documents parallels with emotional speech,pitch height;timing;music and language;speech perception;music cognition;corpus analysis
fpsyg.2013.01024,0.13214285714285715,74,560,Perceptual pitch deficits coexist with pitch production difficulties in music but not Mandarin speech,congenital amusia;tone agnosia;lexical tone;musical pitch;perception;production
fpsyg.2013.00628,0.13214285714285715,74,560,Dual conception of risk in the Iowa Gambling Task: effects of sleep deprivation and test-retest gap,Iowa Gambling Task;decision making;risk;rewardpunishment;sleep deprivation;test-retest gap
fpsyg.2014.00105,0.13213703099510604,81,613,The role of conceptual knowledge in understanding synaesthesia: Evaluating contemporary findings from a hub-and-spokes perspective,synesthesia;multisensory integration;attention;color memory;object knowledge
fpsyg.2015.00312,0.1316270566727605,72,547,Working memory differences in long-distance dependency resolution,locality;antilocality;working memory capacity;individual differences;Spanish;activation;DLT;expectation
fpsyg.2015.00980,0.1295971978984238,74,571,A dance movement therapy group for depressed adult patients in a psychiatric outpatient clinic: effects of the treatment,dance movement therapy;depression;antidepressants;treatment outcome;group therapy;psychiatric outpatient clinic
fpsyg.2012.00290,0.12920353982300886,73,565,Motor Consciousness during Intention-Based and Stimulus-Based Actions: Modulating Attention Resources through Mindfulness Meditation,grip force;sensation;consciousness;attention;dual task;mindfulness;motor planning;intention
fpsyg.2015.00595,0.1284722222222222,74,576,Emotional expression recognition and attribution bias among sexual and violent offenders: a signal detection analysis,sexual offender;antisocial;facial expression;emotion;signal detection theory (SDT)
fpsyg.2016.00823,0.12811387900355872,72,562,Measuring the Performance of Attention Networks with the Dalhousie Computerized Attention Battery (DalCAB): Methodology and Reliability in Healthy Adults,computerized assessment;attention;orienting;alerting;executive function
fpsyg.2016.01040,0.12794612794612795,76,594,Positive Affect Is Inversely Associated with Mortality in Individuals without Depression,experienced well-being;evaluative well-being;mortality;longitudinal study;depression
fpsyg.2015.01491,0.1273344651952462,75,589,Neural correlates of gratitude,affective neuroscience;fMRI;Holocaust testimony;pro-social behavior;altruism
fpsyg.2014.01513,0.12585034013605442,74,588,Skilled performance tests and their use in diagnosing handedness and footedness at children of lower school age 8 10,handedness;footedness;performance tests;laterality;children;fine motor;gross motor
fpsyg.2013.00489,0.12568306010928962,69,549,Design and evaluation of the computer-based training program Calcularis for enhancing numerical cognition,learning;intervention;optimization;calculation;spatial representation;interactive learning environment
fpsyg.2014.00502,0.1254295532646048,73,582,Is crying a self-soothing behavior?,emotion regulation;self-soothing;social-soothing;mood management;crying
fpsyg.2014.00012,0.125,73,584,"Hedonic appreciation and verbal description of pleasant and unpleasant odors in untrained, trainee cooks, flavorists, and perfumers",olfaction;expertise;hedonic;emotion;perfumery
fpsyg.2015.01071,0.12369337979094076,71,574,"Auditory verbal hallucinations in schizophrenia and post-traumatic stress disorder: common phenomenology, common cause, common interventions?",abuse;dissociation;hallucinations;hearing voices;memory;PTSD;psychosis;traumatology
fpsyg.2014.01514,0.12353923205342238,74,599,Exposure to trauma-relevant pictures is associated with tachycardia in victims who had experienced an intense peritraumatic defensive response: the tonic immobility,emotion;defensive responses;tonic immobility;heart rate;trauma-relevant pictures;individual difference;stimuli relevance
fpsyg.2013.00281,0.12142857142857143,68,560,On Disturbed Time Continuity in Schizophrenia: An Elementary Impairment in Visual Perception?,schizophrenia;time;anticipation;synchrony;attention;implicit processing;Simon effect
fpsyg.2012.00352,0.12059369202226346,65,539,Effects of Social Support by a Dog on Stress Modulation in Male Children with Insecure Attachment,attachment;human-dog interaction;social support;stress regulation;children;cortisol
fpsyg.2016.00805,0.12020033388981637,72,599,Mindfulness-Oriented Meditation for Primary School Children: Effects on Attention and Psychological Well-Being,primary school children;mindfulness-meditation;teachers report;attention;psychological well-being
fpsyg.2013.00265,0.11940298507462686,72,603,Enhancing SART Validity by Statistically Controlling Speed-Accuracy Trade-Offs,SART;speed-accuracy trade-off;attention;sustained attention
fpsyg.2012.00288,0.11839708561020036,65,549,Psychosocial Vulnerabilities to Depression after Acute Coronary Syndrome: The Pivotal Role of Rumination in Predicting and Maintaining Depression,psychosocial vulnerabilities;post-ACS;depression;rumination;cardiovascular disease
fpsyg.2014.01500,0.11837455830388692,67,566,"Segmentation of dance movement: effects of expertise, visual familiarity, motor experience and music",expertise;event segmentation;dance;movement learning;motor experience;music
fpsyg.2013.00540,0.11725293132328309,70,597,Abnormal task modulation of oscillatory neural activity in schizophrenia,schizophrenia;oscillations;alpha;beta;AX-CPT;cognitive;motor preparation
fpsyg.2015.01709,0.11583011583011583,60,518,Americans Still Overestimate Social Class Mobility: A Pre-Registered Self-Replication,social class;replication;intergroup relations;social cognition;motivated cognition
fpsyg.2012.00552,0.11580882352941177,63,544,When the Ignored Gets Bound: Sequential Effects in the Flanker Task,flanker task;cognitive control;conflict monitoring;sequential dependencies;associative learning;episodic binding
fpsyg.2011.00183,0.11517367458866545,63,547,Is There a Relationship between Language Switching and Executive Functions in Bilingualism? Introducing a within group Analysis Approach,bilingualism;executive functions;inhibition;set shifting;updating;language switching
fpsyg.2016.00440,0.11472602739726027,67,584,Children s Expectations and Understanding of Kinship as a Social Category,social cognition;kin preference;development;social categories;resource sharing
fpsyg.2014.01282,0.11456628477905073,70,611,Inferring reward prediction errors in patients with schizophrenia: a dynamic reward task for reinforcement learning,Bayesian estimation method;dynamic reward task;matching law;psychosis;reinforcement learning model;reward prediction error;schizophrenia
fpsyg.2012.00489,0.11449016100178891,64,559,Cognitive and Neural Aspects of Information Processing in Major Depressive Disorder: An Integrative Perspective,depression;MDD;neuroimaging;amygdala;interpretation bias;attention bias;memory bias;cognitive control
fpsyg.2015.00691,0.1141804788213628,62,543,Compensating for age limits through emotional crossmodal integration,aging;emotion;faces;voices;non-verbal vocalizations;multimodal integration;race model
fpsyg.2015.01968,0.11343804537521815,65,573,The Sense of Commitment: A Minimal Approach,commitment;joint action;cooperation;coordination;development
fpsyg.2013.00339,0.11307420494699646,64,566,Age-related changes in visual exploratory behavior in a natural scene setting,oculomotor behavior;eye movements;visual attention;driving simulator;aging;video game experience
fpsyg.2016.00111,0.11186440677966102,66,590,Infants Understanding of Object-Directed Action: An Interdisciplinary Synthesis,infant goal attribution;mirror neurons;object cognition;social cognition;action prediction
fpsyg.2013.00527,0.11090909090909092,61,550,Attentional capture by social stimuli in young infants,face perception;sex differences;infant development;attention;saliency map
fpsyg.2015.01378,0.11090909090909092,61,550,Manipulating target size influences perceptions of success when learning a dart-throwing skill but does not impact retention,motor learning;feedback;error-processing;motivation;self-efficacy;success evaluation
fpsyg.2013.00482,0.11030741410488246,61,553,Relationships between dimensional factors of psychopathy and schizotypy,psychopathy;schizotypy;self-centered impulsivity;fearless dominance;schizophrenia
fpsyg.2016.00993,0.10990990990990991,61,555,Differences in the Association between Segment and Language: Early Bilinguals Pattern with Monolinguals and Are Less Accurate than Late Bilinguals,speech perception;foreign-accented speech;bilingualism;language categorization;Spanish phonology;English phonology;metalinguistic awareness
fpsyg.2015.00201,0.1097972972972973,65,592,Parsing (malicious) pleasures: schadenfreude and gloating at others adversity,schadenfreude;gloating;pride;joy;satisfaction;emotion;group;competition
fpsyg.2013.00737,0.10956521739130434,63,575,Advanced analysis of free visual exploration patterns in schizophrenia,schizophrenia;visual scanpath;visual exploration;focal processing;exploration strategy;attentional landscape;scanpath similarity
fpsyg.2016.00652,0.10843373493975904,63,581,Prospective Associations between Emotion Dysregulation and Fear-Potentiated Startle: The Moderating Effect of Respiratory Sinus Arrhythmia,emotion regulation;fear-potentiated startle;respiratory sinus arrhythmia;trauma;physiology
fpsyg.2016.00073,0.10839160839160839,62,572,Frontal Cortical Asymmetry May Partially Mediate the Influence of Social Power on Anger Expression,power;emotion;expressivity;frontal alpha asymmetry;mediator
fpsyg.2014.00568,0.108348134991119,61,563,The shadow of a doubt? Evidence for perceptuo-motor linkage during auditory and audiovisual close-shadowing,speech perception;speech production;audiovisual speech perception;close-shadowing;sensorimotor interactions
fpsyg.2013.00786,0.10745233968804159,62,577,Brain responses to odor mixtures with sub-threshold components,fMRI;smell;olfactory;mixing
fpsyg.2015.01089,0.10727272727272727,59,550,Deceit and facial expression in children: the enabling role of the poker face child and the dependent personality of the detector,deceit;children;facial expression;emotion;dependent personality;gender differences
fpsyg.2014.01134,0.10664335664335664,61,572,"What determines the specificity of conflict adaptation? A review, critical analysis, and proposed synthesis",cognitive control;congruency sequence effect;task structure;associative learning
fpsyg.2011.00348,0.1065891472868217,55,516,"Glancing and Then Looking: On the Role of Body, Affect, and Meaning in Cognitive Control",computational modeling;attentional blink;emotion;cognitive control;body-state
fpsyg.2014.01160,0.10575139146567718,57,539,Mutual influences of pain and emotional face processing,pain;emotion;facial expression;ERPs;perception-action
fpsyg.2015.00007,0.10571923743500866,61,577,Validation of the Chinese version of the Clinical Assessment Interview for Negative Symptoms (CAINS): a preliminary report,negative symptoms;schizophrenia;validation
fpsyg.2015.01902,0.10545454545454545,58,550,The Effects of Changing Attention and Context in an Awake Offline Processing Period on Visual Long-Term Memory,offline processing;attention;context;consolidation;intermediate memory;working memory;recognition memory
fpsyg.2013.00597,0.10481099656357389,61,582,Maternal status regulates cortical responses to the body odor of newborns,body odor;bonding;fMRI;neonatal;reward
fpsyg.2015.01485,0.10431654676258993,58,556,Using interpersonal affect regulation in simulated healthcare consultations: an experimental investigation of self-control resource depletion,affect regulation;self-regulation;conservation of resources;ego depletion;performance;emotion;healthcare
fpsyg.2015.00997,0.10344827586206896,57,551,Quantum-like model of unconscious conscious dynamics,sensation;perception;quantum-like model;quantum apparatuses and instruments;bistable perception;unconscious inference
fpsyg.2012.00349,0.10278745644599303,59,574,Framing Attention in Japanese and American Comics: Cross-Cultural Differences in Attentional Structure,cultural psychology;visual language;comics;attention;manga
fpsyg.2012.00053,0.10265486725663717,58,565,Episodic and Semantic Autobiographical Memory and Everyday Memory during Late Childhood and Early Adolescence,autobiographical memory;everyday memory;sex differences;childhood;adolescence;development
fpsyg.2013.01019,0.10172413793103448,59,580,Cognitive strategies to regulate emotions current evidence and future directions,emotion regulation;reappraisal;distraction;labeling;cognitive strategies
fpsyg.2014.00974,0.10088495575221239,57,565,The joint Simon effect: a review and theoretical integration,joint action;joint Simon effect;social cognition;stimulus-response compatibility;referential coding;review
fpsyg.2013.00088,0.10051993067590988,58,577,Visual Surround Suppression in Schizophrenia,schizophrenia;surround suppression;cortex;contrast;luminance;size;orientation;perception
fpsyg.2012.00175,0.10036496350364964,55,548,Remembering Another Aspect of Forgetting,memory;fear;stimulus attributes;amygdala;hippocampus;context;generalization
fpsyg.2013.00066,0.09947643979057591,57,573,Perceptual Learning and Aging: Improved Performance for Low-Contrast Motion Discrimination,perceptual learning;aging;motion perception;spatial suppression;contrast
fpsyg.2014.01250,0.09800362976406533,54,551,Using multivariate decoding to go beyond contrastive analyses in consciousness research,consciousness;multivariate decoding;multivariate pattern analysis;contrastive analyses;MEG;fMRI
fpsyg.2014.00926,0.09769094138543517,55,563,Sex differences in the inference and perception of causal relations within a video game,causal inference;causal perception;learning;video games;sex differences
fpsyg.2016.01059,0.09661016949152543,57,590,Joint Perception of a Shared Object: A Minimalist Perceptual Crossing Experiment,perceptual crossing;Participatory Sense-Making (PSM);social cognition;joint attention;minimalism
fpsyg.2015.01319,0.09624796084828711,59,613,The precision of 12-month-old infants link between language and categorization predicts vocabulary size at 12 and 18 months,word learning;categorization;infants;individual differences;vocabulary;longitudinal
fpsyg.2016.00280,0.09609120521172639,59,614,When High-Capacity Readers Slow Down and Low-Capacity Readers Speed Up: Working Memory and Locality Effects,locality;working memory capacity;individual differences;Spanish;German;ACT-R
fpsyg.2013.00970,0.09565217391304348,55,575,Verbal overshadowing of face memory does occur in children too!,verbal overshadowing;face processing;episodic memory;development;interference
fpsyg.2014.01116,0.09533073929961089,49,514,Structural brain changes related to bilingualism: does immersion make a difference?,bilingualism;naturalistic learning;immersion;second language;structural plasticity;VBM;DTI
fpsyg.2012.00555,0.09490333919156414,54,569,Neural Correlates of Switching Attentional Focus during Finger Movements: An fMRI Study,attentional focus switch;finger tapping task;fMRI;premotor cortex;intraparietal lobule
fpsyg.2015.00084,0.09450171821305842,55,582,An fMRI investigation of expectation violation in magic tricks,expectation violation;magic;fMRI;caudate nucleus;perceptual prediction error;movement observation;action
fpsyg.2014.00451,0.09369676320272573,55,587,Counterfactual thinking in moral judgment: an experimental study,moral dilemma;decision making;gender;aging;utilitaristic reasoning
fpsyg.2016.00285,0.09342560553633218,54,578,Effects of Working Memory Capacity on Metacognitive Monitoring: A Study of Group Differences Using a Listening Span Test,working memory;metacognition;monitoring;working memory capacity;individual differences
fpsyg.2015.01046,0.09323583180987204,51,547,Statistical learning and adaptive decision-making underlie human response time variability in inhibitory control,bayesian modeling;decision making;learning;response time;psychophysics;inhibitory control;stop signal task
fpsyg.2012.00084,0.09293680297397769,50,538,A Network Model of Observation and Imitation of Speech,speech;language;mirror neuron;structural equation modeling;effective connectivity;action observation;ventral premotor cortex;brain imaging
fpsyg.2013.00203,0.09242144177449169,50,541,Accentuate the Positive: Semantic Access in English Compounds,morphological processing;semantics;emotion;valence;lexical decision
fpsyg.2011.00009,0.09217391304347826,53,575,Competition for Cognitive Resources During Rapid Serial Processing: Changes Across Childhood,attention;development;children;rapid serial visual processing;attentional blink
fpsyg.2015.01181,0.09154929577464789,52,568,Self perception and facial emotion perception of others in anorexia nervosa,eating disorders;fMRI;eyetracking;eye movements;affect
fpsyg.2015.00404,0.09107806691449814,49,538,Bifactor analysis and construct validity of the five facet mindfulness questionnaire (FFMQ) in non-clinical Spanish samples,five facet mindfulness questionnaire;bifactor model;structural equation modeling;anxiety;depression
