article id,fp ratio,fp count,support,title,original keywords
fpsyg.2015.01067,0.635,381,600,"Intrinsic and extrinsic motivation is associated with computer-based auditory training uptake, engagement, and adherence for people with hearing loss",auditory training;motivation;engagement;adherence;hearing loss;sensorineural;Self-Determination Theory
fpsyg.2012.00607,0.6341463414634146,364,574,Adaptive Associations between Social Cognition and Emotion Regulation are Absent in Schizophrenia and Bipolar Disorder,social cognition;emotion;cognitive emotion regulation;schizophrenia;bipolar disorder
fpsyg.2013.01003,0.634020618556701,369,582,Affordances and the musically extended mind,music;affordances;extended cognition;emotions;emotion regulation;phenomenology
fpsyg.2015.01390,0.6333333333333333,361,570,Speech intelligibility and recall of first and second language words heard at different signal-to-noise ratios,noise;recall;speech intelligibility;word lists;signal-to-noise ratio;working memory;working memory capacity
fpsyg.2014.00624,0.6332737030411449,354,559,Belief in optimism might be more problematic than actual optimism,time;optimism;bias;prototype;memory;future
fpsyg.2015.01750,0.6329113924050633,350,553,What is the Value of Embedding Artificial Emotional Prosody in Human Computer Interactions? Implications for Theory and Design in Psychological Science,social cognition;emotion;prosody;artificial speech;humancomputer interaction
fpsyg.2016.00230,0.6308492201039861,364,577,To Switch or Not to Switch: Role of Cognitive Control in Working Memory Training in Older Adults,working memory training;cognitive control;healthy aging;strategies of training;individual differences
fpsyg.2014.01175,0.6307129798903108,345,547,Temporal structure of consciousness and minimal self in schizophrenia,schizophrenia;time perception;self-concept;consciousness;psychology of the self;psychopathology;experimental psychology
fpsyg.2015.01989,0.6304728546409807,360,571,Effect of Frustration on Brain Activation Pattern in Subjects with Different Temperament,frustration;temperament;tactile discrimination;fMRI;individual differences;stress
fpsyg.2012.00450,0.6284246575342466,367,584,On the Influence of Reward on Action-Effect Binding,reward;motivation;ideomotor theory;action-effects;inter-individual differences
fpsyg.2015.01564,0.6280276816608996,363,578,"Me, myself, and I: self-referent word use as an indicator of self-focused attention in relation to depression and anxiety",self-focused attention;language;pronoun use;depression;chronic depression;anxiety
fpsyg.2014.01584,0.6274165202108963,357,569,Option generation in decision making: ideation beyond memory retrieval,option generation;decision structuring;decision making;memory;ideation
fpsyg.2011.00395,0.6263940520446096,337,538,An Interoceptive Predictive Coding Model of Conscious Presence,presence;consciousness;depersonalization disorder;agency;interoception;insular cortex;virtual reality;predictive coding
fpsyg.2015.01805,0.6254416961130742,354,566,Prefrontal Cortex and Social Cognition in Mouse and Man,social cognition;social behavior;prefrontal cortex;autism;schizophrenia
fpsyg.2013.00886,0.6240740740740741,337,540,Socio-emotional correlates of a schooldog-teacher-team in the classroom,animal-assisted education;classroom;dog;emotion regulation;school;children
fpsyg.2015.00721,0.6230899830220713,367,589,The benefit of amplification on auditory working memory function in middle-aged and young-older hearing impaired adults,age-related hearing loss;presbycusis;aging;hearing aids;working memory
fpsyg.2014.00276,0.6217162872154116,355,571,Gender and the performance of music,music;performance;musical meaning;gender;sex differences
fpsyg.2015.00327,0.6196213425129088,360,581,Intra-individual variability and continuity of action and perception measures in infants,action;perception;infancy;variability;continuity
fpsyg.2012.00340,0.6157894736842106,351,570,"A Transformative Subfield in Rehabilitation Science at the Nexus of New Technologies, Aging, and Disability",aging;disability;technology;eHealth;rehabilitation;chronic care model;quality of life;interactive media
fpsyg.2015.00663,0.6151079136690647,342,556,Reorganization of brain networks in aging: a review of functional connectivity studies,fMRI;brain networks;aging;memory;connectivity;independent component analysis;default mode network
fpsyg.2015.00525,0.6151012891344383,334,543,Improving executive function in childhood: evaluation of a training intervention for 5-year-old children,executive function;training;preschool;inhibition (psychology);working memory;cognitive flexibility
fpsyg.2015.00028,0.6146953405017921,343,558,Toward a neural basis for peer-interaction: what makes peer-learning tick?,socio-constructivism;peer-learning;motivation;intersubjectivity;reciprocity;cooperation;reward
fpsyg.2016.00765,0.6115992970123023,348,569,Emotion and Value in the Evaluation of Medical Decision-Making Capacity: A Narrative Review of Arguments,competence;decision-making capacity;emotion;value;self-determination;informed consent;review
fpsyg.2015.00164,0.6108949416342413,314,514,Balanced bilingualism and early age of second language acquisition as the underlying mechanisms of a bilingual executive control advantage: why variations in bilingual experiences matter,executive control;bilingualism;age of acquisition;language usage;language proficiency
fpsyg.2014.00822,0.6090750436300174,349,573,"The emergence of human prosociality: aligning with others through feelings, concerns, and norms",other-regarding concerns;empathy;normativity;altruism;evolution of prosociality;children;great apes
fpsyg.2011.00397,0.6062176165803109,351,579,On the Neural Mechanisms Subserving Consciousness and Attention,attention;consciousness;vision;imaging;MEG;electrophysiology;fMRI;review
fpsyg.2013.00529,0.6039426523297491,337,558,Are patients with schizophrenia impaired in processing non-emotional features of human faces?,schizophrenia;vision;face;identity;detection;recognition;gait;perception
fpsyg.2015.00443,0.6018018018018018,334,555,The role of personal purpose and personal goals in symbiotic visions,higher purpose;calling;meaning;vision;shared vision;motivation;engagement;relationships
fpsyg.2015.00802,0.6017391304347826,346,575,The relationship between the development of response inhibition and intelligence in preschool children,response inhibition;intelligence;development;age-related differences;preschool children
fpsyg.2013.00558,0.6014109347442681,341,567,Why are there different types of synesthete?,individual differences;visual imagery;synaesthesia;synesthesia;projector;associator
fpsyg.2014.01392,0.6010452961672473,345,574,A psychologically-based taxonomy of misdirection,misdirection;attention;magic;memory;perception;reasoning;taxonomy
fpsyg.2012.00327,0.6003552397868561,338,563,Music and Early Language Acquisition,music;language;language acquisition;childhood development;musical development;music cognition;definition of music;emergent modularity
fpsyg.2013.00560,0.5962837837837838,353,592,Young and restless: validation of the Mind-Wandering Questionnaire (MWQ) reveals disruptive impact of mind-wandering for youth,mind-wandering;attention;reading comprehension;K-12 education;well-being
fpsyg.2016.00228,0.5946843853820598,358,602,The Relationship between Social and Motor Cognition in Primary School Age-Children,social cognition;motor skill;theory of mind;imitation;action understanding
fpsyg.2015.00541,0.5923344947735192,340,574,Gollin's (1965) levels-by-levels approach: the importance of manipulating the task dimension when assessing age-related changes and individual differences in decision making,cognitive development;child development;decision making;delay of gratification;contextual variables;levels by levels approach;behavioral economics
fpsyg.2015.01579,0.5858407079646017,331,565,Beyond mechanistic interaction: value-based constraints on meaning in language,distributed cognition;embodied cognition;values;language as social coordination;language development;dynamical systems
fpsyg.2014.01428,0.5849387040280211,334,571,Would you fund this movie? A reply to Fox et al. (2014),thinking;directed thought;consciousness;affect;enjoyment;boredom
fpsyg.2014.00773,0.5847299813780261,314,537,Interaction between physiological and subjective states predicts the effect of a judging panel on the postures of cellists in performance,motor control;music;anxiety;electrodermal activity;cardiac response
fpsyg.2015.00963,0.5836363636363636,321,550,The association between perceived maternal and paternal psychopathology and depression and anxiety symptoms in adolescent girls,depression;anxiety;adolescents;girls;parental psychopathology;intergenerational transmission
fpsyg.2013.00910,0.5815972222222222,335,576,Influence of music on steroid hormones and the relationship between receptor polymorphisms and musical ability: a pilot study,music;cortisol;testosterone;17-beta estradiol;androgen receptor;polymorphism;AMMA
fpsyg.2011.00359,0.5801011804384486,344,593,Five- to 7-Year-Olds Finger Gnosia and Calculation Abilities,finger gnosia;computational finger-use;spatial processes;individual differences;young children
fpsyg.2013.00914,0.579225352112676,329,568,Plasticity of visual attention in Isha yoga meditation practitioners before and after a 3-month retreat,meditation;attention;Stroop task;attentional blink;global-local task
fpsyg.2013.00660,0.577922077922078,356,616,"Training, hypnosis, and drugs: artificial synaesthesia, or artificial paradises?",induced synaesthesia;synaesthesia;crossmodal correspondences;pseudo-synaesthesia;learning;genetic basis;drugs;hypnosis
fpsyg.2015.01627,0.5738317757009346,307,535,Motor and cognitive growth following a Football Training Program,children;Football Exercise Program;motor skills;visual selective attention;visual discrimination
fpsyg.2014.00409,0.5721830985915493,325,568,A new adaptive videogame for training attention and executive functions: design principles and initial validation,videogames;attention;attention deficits;executive functions;cognitive enhancement
fpsyg.2014.00940,0.5714285714285714,316,553,It is time to combine the two main traditions in the research on the neural correlates of consciousness: C = L D,consciousness;neural correlates of consciousness;contents;level;state;visiual perception;thalamus;excitatory postsynaptic potentials
fpsyg.2015.01947,0.5711645101663586,309,541,How a (sub)Cellular Coincidence Detection Mechanism Featuring Layer-5 Pyramidal Cells May Help Produce Various Visual Phenomena,consciousness;neural correlates of consciousness;visual perception;illusions;phenomenology;neuromodulation;dendrites;pyramidal cells
fpsyg.2012.00168,0.5709459459459459,338,592,Social Cognition in Williams Syndrome: Genotype/Phenotype Insights from Partial Deletion Patients,social cognition;Williams syndrome;partial deletion patients;genetic disorders;autism spectrum disorders;genotype/phenotype relations
fpsyg.2014.00159,0.5682210708117443,329,579,Global timing: a conceptual framework to investigate the neural basis of rhythm perception in humans and non-human species,music;rhythm;grouping;meter;beat;tempo;brain;fMRI
fpsyg.2015.00096,0.5672913117546848,333,587,"Control your mind, make affordance available",affordance control;ecological approach;action;perception;biofunctional understanding;embodied cognition
fpsyg.2013.00406,0.566607460035524,319,563,"Thirty shades of truth: conspiracy theories as stories of individuation, not of pathological delusion",conspiracy theories;narrative construction;personality science;individual differences;external validity;regulation;psychological methods
fpsyg.2014.00283,0.5665467625899281,315,556,Do cavies talk? The effect of anthropomorphic picture books on children's knowledge about animals,picture books;preschoolers;learning;animals;anthropomorphism
fpsyg.2012.00438,0.5654545454545454,311,550,When Emotion Blinds: A Spatiotemporal Competition Account of Emotion-Induced Blindness,emotion-induced blindness;attention;perception;spatiotemporal competition;biased competition;emotion;visual awareness
fpsyg.2014.01452,0.564748201438849,314,556,Facing danger: how do people behave in times of need? The case of adult attachment styles,attachment;anxiety;avoidance;defensive behavior;social defense theory
fpsyg.2016.00705,0.5595026642984015,315,563,Brain Oscillatory Correlates of Altered Executive Functioning in Positive and Negative Symptomatic Schizophrenia Patients and Healthy Controls,positive and negative symptomatic schizophrenia;brain oscillations;executive functions;working memory;fronto-parietal network;theta;gamma;positive and negative symptomatic schizophrenia;brain oscillations;executive functions;working memory;fronto-parietal network;theta;gamma
fpsyg.2014.01016,0.5584642233856894,320,573,Shared intentional engagement through language and phenomenal experience,interaction;engagement;intentionality;consciousness;phenomenology;phenomenal experience;experience;sensations
fpsyg.2015.01547,0.5569852941176471,303,544,"Music stimulates muscles, mind, and feelings in one go",music;gait;training;rhythmic auditory stimulation
fpsyg.2015.01325,0.5540308747855918,323,583,Motivation for aggressive religious radicalization: goal regulation theory and a personality threat affordance hypothesis,religion;radicalization;aggression;approach motivation;avoidance motivation;anxiety;groups
fpsyg.2015.01916,0.5529622980251346,308,557,Emotion Understanding in Clinically Anxious Children: A Preliminary Investigation,emotion understanding;anxiety;emotion regulation;attachment;children;clinical sample
fpsyg.2014.01587,0.5528052805280528,335,606,Attentional asymmetries cause or consequence of human right handedness?,handedness;laterality development;bimanual coordination;attention;motor control;laterality of motor control
fpsyg.2011.00309,0.5523978685612788,311,563,The Influence of Expertise in Simultaneous Interpreting on Non-Verbal Executive Processes,simultaneous interpreting;bilingualism;executive processes;cognitive flexibility;inhibitory processes
fpsyg.2015.01690,0.5462794918330308,301,551,Words as cultivators of others minds,linguification;embodied cognition;derived embodiment;back door entry;linguistic handle;other minds;first-order language
fpsyg.2014.01293,0.5459363957597173,309,566,Closing in on the constitution of consciousness,consciousness;neural correlates;constitution;binocular rivalry;philosophy of mind;mechanistic explanation;foundations;philosophy of science
fpsyg.2015.01239,0.542907180385289,310,571,Theory of mind in women with borderline personality disorder or schizophrenia: differences in overall ability and error patterns,borderline personality disorder;schizophrenia;social cognition;theory of mind;mentalizing
fpsyg.2015.00912,0.5418060200668896,324,598,"The associations among the dopamine D2 receptor Taq1, emotional intelligence, creative potential measured by divergent thinking, and motivational state and these associations' sex differences",emotional intelligence;mood;dopamine;creativity;divergent thinking;motivation;creative potential
fpsyg.2014.00090,0.5412541254125413,328,606,Music reduces pain and increases functional mobility in fibromyalgia,fibromyalgia;music;pain;analgesia;functional mobility
fpsyg.2015.01417,0.5396551724137931,313,580,Emotional processing in Parkinson s disease and schizophrenia: evidence for response bias deficits in PD,facial emotion recognition;mild cognitive impairment;Parkinsons disease;response bias;schizophrenia;signal detection theory
fpsyg.2011.00060,0.539543057996485,307,569,Ongoing EEG Phase as a Trial-by-Trial Predictor of Perceptual and Attentional Variability,EEG;oscillation;phase;pre-stimulus;spontaneous;ongoing;perception;attention
fpsyg.2013.00945,0.5375,301,560,"The lognormal handwriter: learning, performing, and declining",kinematic theory;lognormal models;handwriting analysis and generation;neuromuscular systems;learning;aging;lognormality
fpsyg.2015.00876,0.5372050816696915,296,551,Effects of word-evoked object size on covert numerosity estimations,numerosity estimation;digitword expression;numerical cognition;embodied cognition
fpsyg.2014.00498,0.536283185840708,303,565,Assimilation and contrast effects in suboptimal affective priming paradigm,suboptimal affective priming;assimilation effect;contrast effect;emotion regulation
fpsyg.2014.00605,0.5351851851851852,289,540,Inter-rater reliability for movement pattern analysis (MPA): measuring patterning of behaviors versus discrete behavior counts as indicators of decision-making style,decision-making;individual differences;observational methods;movement pattern analysis;inter-rater reliability
fpsyg.2011.00234,0.5327586206896552,309,580,Executive Control of Language in the Bilingual Brain: Integrating the Evidence from Neuroimaging to Neuropsychology,executive control;bilingualism;dorsolateral prefrontal cortex;parietal lobe;basal ganglia;anterior cingulate cortex;language switching;simultaneous interpretation
fpsyg.2016.00118,0.5326797385620915,326,612,Outcome Knowledge and False Belief,curse of knowledge;theory of mind;hindsight bias;perspective taking;social cognition
fpsyg.2015.00964,0.5296167247386759,304,574,Cross-cultural comparison of motor competence in children from Australia and Belgium,motor competence;motor assessment;KTK;children;cross-cultural comparison;Belgium;Australia
fpsyg.2014.00736,0.5286738351254481,295,558,How incorporation of scents could enhance immersive virtual experiences,virtual reality;olfactory display;olfactometer;emotion;scent
fpsyg.2015.00686,0.5269565217391304,303,575,"Editorial: Behavioral and physiological bases of attentional biases: paradigms, participants, and stimuli",attentional bias;bias indices;attentional ERPs;anxiety;depression;dot-probe task
fpsyg.2012.00227,0.5248618784530387,285,543,Attention Deficits Predict Phenotypic Outcomes in Syndrome-Specific and Domain-Specific Ways,attention;literacy and early reading development;longitudinal data analysis;Down syndrome;Williams syndrome;neurodevelopmental disorders
fpsyg.2014.00967,0.5221238938053098,295,565,Enactivism and neonatal imitation: conceptual and empirical considerations and clarifications,enactivism;neonatal imitation;intersubjectivity;action understanding;social cognition
fpsyg.2015.01129,0.5218150087260035,299,573,Bringing the self into focus: conceptualising the role of self-experience for understanding and working with distressing voices,self;self-experience;voice hearing;auditory verbal hallucinations;psychosis;schizophrenia;phenomenology;psychological intervention
fpsyg.2014.00384,0.5193661971830986,295,568,Age and individual differences in visual working memory deficit induced by overload,aging;capacity limit;individual differences;object recognition;visual working memory
fpsyg.2014.01197,0.5174825174825175,296,572,The facilitation effect and language thresholds,bilingualism;biliteracy;Threshold Hypothesis;facilitation theory;language minority education
fpsyg.2013.01011,0.5171821305841925,301,582,The olfactory system as the gateway to the neural correlates of consciousness,olfaction;consciousness;neural correlates of consciousness;conscious perception;olfactory consciousness
fpsyg.2015.02049,0.5162393162393163,302,585,A Matter of Balance: Motor Control is Related to Children s Spatial and Proportional Reasoning Skills,cognitive development;motor control;balance;proportional reasoning;spatial scaling;inhibitory control;working memory;executive functions
fpsyg.2014.00925,0.5159010600706714,292,566,"Mood, food, and obesity",mood;depression;anxiety;food;obesity
fpsyg.2015.00967,0.5134168157423972,287,559,Metacognitive therapy (MCT+) in patients with psychosis not receiving antipsychotic medication: A case study,schizophrenia;psychotherapy;delusions;cognitive bias;CBT
fpsyg.2015.01018,0.5128205128205128,280,546,Common impairments of emotional facial expression recognition in schizophrenia across French and Japanese cultures,cross-culture;emotional facial expression;France;Japan;schizophrenia
fpsyg.2014.00281,0.5107913669064749,284,556,Free will and paranormal beliefs,free will;paranormal beliefs;consciousness;gender;illusion
fpsyg.2011.00094,0.5093283582089553,273,536,"Transfer of Training between Music and Speech: Common Processing, Attention, and Memory",transfer effects;music training;speech processing;passive listening;mismatch negativity;active discrimination;attention;working memory
fpsyg.2015.00839,0.508833922261484,288,566,Affective responses after different intensities of exercise in patients with traumatic brain injury,traumatic brain injury;mood;anxiety;exercise
fpsyg.2015.01074,0.5083892617449665,303,596,Executive functions in mono- and bilingual children with language impairment issues for speech-language pathology,bilingualism;language impairment;executive functions;bilingual advantage;speech-language pathology
fpsyg.2012.00404,0.5078260869565218,292,575,Motivation Matters: Differing Effects of Pre-Goal and Post-Goal Emotions on Attention and Memory,emotion;arousal;memory narrowing;motivation;goal relevance
fpsyg.2016.00266,0.5036363636363637,277,550,Mind Invasion: Situated Affectivity and the Corporate Life Hack,affect;emotion;situatedness;scaffolding;mind invasion;normativity;workplace
fpsyg.2014.00880,0.503584229390681,281,558,Attention and working memory: two basic mechanisms for constructing temporal experiences,mental time travel;language;thought;attention;working memory;duration;past;future
fpsyg.2013.00890,0.5017361111111112,289,576,"Music, autism, and emotion",music;autism;emotion;experience;listening strategy
fpsyg.2014.01004,0.4981549815498155,270,542,The changing picture of object substitution masking: reply to Di Lollo (2014),visual masking;object substitution;attention;modeling;reentrant;feed-forward
fpsyg.2015.01233,0.4973730297723292,284,571,Benefits of extending and adjusting the level of difficulty on computerized cognitive training for children with intellectual disabilities,intellectual disabilities;working memory;cognitive training;adaptive training;rate of failure;training amount;motivation;training intensity
fpsyg.2014.00825,0.49731663685152055,278,559,Toward a dual-learning systems model of speech category learning,dual-learning systems;procedural learning;reflective;reflexive;aging;depression;computational modeling
fpsyg.2014.01475,0.4924812030075188,262,532,"A task is a task is a task: putting complex span, n-back, and other working memory indicators in psychometric context",working memory;latent factors;psychometrics;complex span;n-back;memory updating
fpsyg.2016.00417,0.4924114671163575,292,593,Learning in Plants: Lessons from Mimosa pudica,plants;learning;classical conditioning;instrumental conditioning;operant conditioning
fpsyg.2014.00800,0.4866785079928952,274,563,Hits and misses: leveraging tDCS to advance cognitive research,working memory;Gestalt grouping;response inhibition;tDCS;cognitive neuroscience
fpsyg.2011.00101,0.4852173913043478,279,575,Enhancement of Speech-Relevant Auditory Acuity in Absolute Pitch Possessors,absolute pitch;syllable perception;music;planum temporale
fpsyg.2016.00631,0.4787985865724382,271,566,Animal Assisted Therapy (AAT) Program As a Useful Adjunct to Conventional Psychosocial Rehabilitation for Patients with Schizophrenia: Results of a Small-scale Randomized Controlled Trial,animal-assisted therapy;psychosocial rehabilitation;adherence to treatment;schizophrenia;PANSS;EuroQol-5 dimensions;salivary cortisol;salivary alpha-amylase
fpsyg.2012.00561,0.47692307692307695,279,585,A Cross-Modal Perspective on the Relationships between Imagery and Working Memory,visual imagery;visuo-spatial sketchpad;working memory;primary visual cortex V1;drawing;fMRI
fpsyg.2014.00850,0.4767857142857143,267,560,Understanding social engagement in autism: being different in perceiving and sharing affordances,social cognition;theory of mind;embodied cognition;affordances;autism spectrum disorder
fpsyg.2011.00249,0.4764595103578154,253,531,Uncertainty and Cognitive Control,uncertainty;cognitive control;executive function;emotion;volatility;ambiguity;monitoring;motivation
fpsyg.2013.00408,0.47594501718213056,277,582,Brain basis of self: self-organization and lessons from dreaming,self-organization;dreaming;brain lesions;self;consciousness
fpsyg.2013.00136,0.4734042553191489,267,564,Neuropsychological functions and visual contrast sensitivity in schizophrenia: the potential impact of comorbid posttraumatic stress disorder (PTSD),schizophrenia;posttraumatic stress disorder (PTSD);neuropsychology neuroimaging;vision tests;psychopathological features
fpsyg.2012.00229,0.4716636197440585,258,547,Calibration Research: Where Do We Go from Here?,calibration;metacognition;self-regulated learning;social cognition;research methods
fpsyg.2015.00500,0.47058823529411764,264,561,The attention schema theory: a mechanistic account of subjective awareness,consciousness;awareness;attention;control theory;attention schema;body schema;biased competition
fpsyg.2013.00810,0.4704861111111111,271,576,"Effects of music learning and piano practice on cognitive function, mood and quality of life in older adults",music;piano;brain plasticity;aging;elderly;training;cognitive function;quality of life
fpsyg.2014.00474,0.46864686468646866,284,606,Experimentally induced distraction impacts cognitive but not emotional processes in think-aloud cognitive assessment,cognitive assessment;think-aloud;distraction;emotion;Articulated Thoughts in Simulated Situations
fpsyg.2014.01061,0.46337308347529815,272,587,Using minimal human-computer interfaces for studying the interactive development of social awareness,social cognition;joint action;social interaction;intersubjectivity;second-person perspective;consciousness;developmental psychology
