article id,fp ratio,fp count,support,title,original keywords
fpsyg.2015.01573,0.03302752293577982,18,545,Contingent self-esteem and vulnerability to depression: academic contingent self-esteem predicts depressive symptoms in students,contingent self-esteem;depression;adolescence;self-esteem level;gender differences;academic contingency of self-worth;self-esteem;contingencies of self-worth
fpsyg.2012.00114,0.03292894280762565,19,577,Effect of the Survival Judgment Task on Memory Performance in Subclinically Depressed People,depression;adaptive memory;survival judgment task;combination hypothesis;subclinical
fpsyg.2016.00301,0.03290676416819013,18,547,Effects of Hearing Loss and Cognitive Load on Speech Recognition with Competing Talkers,speech recognition;competing talkers;attention;working memory;age-related hearing loss
fpsyg.2014.00212,0.03260869565217391,18,552,Attention to advertising and memory for brands under alcohol intoxication,advertising;eye movements;alcohol intoxication;memory;brand recall
fpsyg.2015.00062,0.03260869565217391,18,552,Allocentric spatial learning and memory deficits in Down syndrome,hippocampus;episodic;memory;capacity;resolution;genetic disorder
fpsyg.2014.00074,0.032520325203252036,20,615,Visual cortex in aging and Alzheimer's disease: changes in visual field maps and population receptive fields,aging;Alzheimer's disease;vision;visual field mapping;population receptive field modeling
fpsyg.2015.01258,0.032490974729241874,18,554,Working memory load disrupts gaze-cued orienting of attention,gaze-cued attention;working memory;top-down control;random number generation;executive load
fpsyg.2015.01175,0.032490974729241874,18,554,Individual differences in reading social intentions from motor deviants,perception;action;social cognition;intention;observation;kinematics
fpsyg.2015.01728,0.03185840707964602,18,565,"The Depression Schema: How Labels, Features, and Causal Explanations Affect Lay Conceptions of Depression",schemas;depression;framing;folk psychiatry;concepts
fpsyg.2016.00655,0.03161397670549085,19,601,Does Feedback-Related Brain Response during Reinforcement Learning Predict Socio-motivational (In-)dependence in Adolescence?,fMRI;reinforcement learning;motivation;social relationships in school
fpsyg.2014.00903,0.03153988868274583,17,539,Does the mean adequately represent reading performance? Evidence from a cross-linguistic study,reading;individual differences;cross-linguistic comparison
fpsyg.2015.00577,0.03152364273204904,18,571,A cultural look at moral purity: wiping the face clean,morality;purity;embodiment;metaphor;face;culture
fpsyg.2011.00008,0.03136531365313653,17,542,Quiet Eye Training Facilitates Competitive Putting Performance in Elite Golfers,golf putting;gaze;anxiety;quiet eye;visuomotor control
fpsyg.2015.01604,0.0313588850174216,18,574,Reappraisal writing relieves social anxiety and may be accompanied by changes in frontal alpha asymmetry,expressive writing;reappraisal;emotion regulation;EEG;mental health
fpsyg.2016.00290,0.031198686371100164,19,609,Similar Personality Patterns Are Associated with Empathy in Four Different Countries,empathy;personality;Big Five;culture comparison;emotion
fpsyg.2013.00015,0.030965391621129327,17,549,Temporal Dynamics of Motivation-Cognitive Control Interactions Revealed by High-Resolution Pupillometry,motivation;cognitive control;reward;pupillometry;incentive
fpsyg.2013.00541,0.030797101449275364,17,552,Pleasurable music affects reinforcement learning according to the listener,music;pleasure;reinforcement learning;reward;dopamine;subjectivity;musical experience;listening strategy
fpsyg.2016.00042,0.03041144901610018,17,559,"Mathematics Anxiety, Working Memory, and Mathematics Performance in Secondary-School Children",mathematics anxiety;short-term memory;working memory;inhibitory control
fpsyg.2014.00411,0.030360531309297913,16,527,Baby schema in human and animal faces induces cuteness perception and gaze allocation in children,eye-tracking;children;cuteness;gaze pattern;preferential looking;pet animals
fpsyg.2012.00533,0.030252100840336135,18,595,Changes in Visual Object Recognition Precede the Shape Bias in Early Noun Learning,visual object recognition;shape bias;word learning;development;infants
fpsyg.2015.00640,0.02982456140350877,17,570,Effective connectivity of visual word recognition and homophone orthographic errors,fMRI;orthography;homophone errors;reading;structural equation models;dynamic causal modeling
fpsyg.2014.00863,0.02973977695167286,16,538,Children's identification of familiar songs from pitch and timing cues,song identification;children;cochlear implants;pitch;rhythm;melody
fpsyg.2013.00613,0.029411764705882353,16,544,Symptoms of depression as reported by Norwegian adolescents on the Short Mood and Feelings Questionnaire,depression;adolescent psychology;sex-differences;short mood and feelings questionnaire;factor analysis;statistical
fpsyg.2013.00767,0.029159519725557463,17,583,Experience and generalization in a connectionist model of Mandarin Chinese relative clause processing,Simple Recurrent Networks;relative clauses;sentence processing;Mandarin Chinese;working memory;connectionism
fpsyg.2014.01470,0.02912621359223301,18,618,Age differences in high frequency phasic heart rate variability and performance response to increased executive function load in three executive function tasks,planning;inhibition (psychology);working memory;heart rate variability;respiratory sinus arrhythmia;child;adult
fpsyg.2015.01249,0.02901023890784983,17,586,Family identification: a beneficial process for young adults who grow up in homes affected by parental intimate partner violence,parental intimate partner violence;psychological outcomes;family identification;social identity;psychosocial processes;mediation analysis;self-esteem;anxiety
fpsyg.2015.00585,0.028985507246376812,16,552,What's in and what's out in branding? A novel articulation effect for brand names,branding;embodiment;phonation;sound symbolism;articulation
fpsyg.2014.00453,0.02888086642599278,16,554,Neural processing of visual information under interocular suppression: a critical review,visual perception;binocular rivalry;interocular suppression;neuroimaging;consciousness
fpsyg.2012.00254,0.028846153846153848,15,520,Dynamic Coding of Signed Quantities in Cortical Feedback Circuits,codes;cortex;learning;receptive field;sensory;sparse coding;synapses
fpsyg.2011.00355,0.02872531418312388,16,557,The Dynamics of Reference and Shared Visual Attention,language;reference;vision;attention;coordination;synchrony;interaction;communication
fpsyg.2013.00054,0.028622540250447227,16,559,Processing Facial Expressions of Emotion: Upright vs. Inverted Images,facial expressions;emotion;inversion;Same/Different;signal detection theory;multidimensional scaling;categorization;featural analysis
fpsyg.2015.00483,0.02821869488536155,16,567,The embodied dynamics of perceptual causality: a slippery slope?,causality;friction;embodied cognition;event perception;prediction
fpsyg.2015.00145,0.02821869488536155,16,567,How do subvocal rehearsal and general attentional resources contribute to verbal short-term memory span?,working memory;verbal short-term memory;attentional capacity;rehearsal;neo-Piagetian models;M capacity;order errors;short-term memory models
fpsyg.2016.00097,0.028169014084507043,16,568,How Early is Infants' Attention to Objects and Actions Shaped by Culture? New Evidence from 24-Month-Olds Raised in the US and China,infants;attention;culture;dynamic events;actions;objects;china;united states
fpsyg.2014.00035,0.028070175438596492,16,570,"The outlandish, the realistic, and the real: contextual manipulation and agent role effects in trolley problems",context effects;decision making;hypothetical scenarios;responsibility;trolley problems
fpsyg.2013.00100,0.027472527472527472,15,546,Fast and Famous: Looking for the Fastest Speed at Which a Face Can be Recognized,face recognition;familiarity;famous faces;go/no-go;SAB;speed constraints;memory
fpsyg.2015.00457,0.027303754266211604,16,586,Sounding Black or White: priming identity and biracial speech,biracial identity;priming;language;speech perceptions;styleswitching
fpsyg.2013.00742,0.02727272727272727,15,550,Can mind-wandering be timeless? Atemporal focus and aging in mind-wandering paradigms,mind-wandering;task-unrelated thought;temporal focus;aging;SART;prospection;retrospection
fpsyg.2013.00787,0.02717391304347826,15,552,Recognition memory across the lifespan: the impact of word frequency and study-test interval on estimates of familiarity and recollection,aging;development;episodic memory;recognition memory;lifespan
fpsyg.2013.00507,0.027164685908319185,16,589,Contribution of coherent motion to the perception of biological motion among persons with Schizophrenia,biological motion;schizophrenia;paranoid;motion;global mechanisms;local mechanisms;perception
fpsyg.2011.00156,0.026981450252951095,16,593,"Effects of Practice and Experience on the Arcuate Fasciculus: Comparing Singers, Instrumentalists, and Non-Musicians",plasticity;white matter;arcuate fasciculus;auditorymotor interactions;tractography;music;singing
fpsyg.2015.00310,0.026923076923076925,14,520,Shifting goals: effects of active and observational experience on infants understanding of higher order goals,action understanding;action perception links;means-end actions;social cognition;motor learning;infant cognition
fpsyg.2014.01069,0.02689075630252101,16,595,Variations on the bilingual advantage? Links of Chinese and English proficiency to Chinese American children's self-regulation,bilingualism;self-regulation;immigrant children
fpsyg.2015.00532,0.026785714285714284,15,560,Cognitive reflection vs. calculation in decision making,numeracy;Cognitive Reflection Test;biases;financial outcomes;individual differences;dual-system theory
fpsyg.2015.01315,0.026595744680851064,15,564,The impact of threat of shock on the framing effect and temporal discounting: executive functions unperturbed by acute stress?,threat of shock;stress;temporal discounting;framing effect;anxiety;depression;executive function;Bayesian models
fpsyg.2015.00652,0.025996533795493933,15,577,A new approach for modeling generalization gradients: a case for hierarchical models,stimulus generalization;repeated measures ANOVA;hierarchical (linear) models;individual differences;R;lme4
fpsyg.2015.01718,0.025996533795493933,15,577,Studying Musical and Linguistic Prediction in Comparable Ways: The Melodic Cloze Probability Method,music;language;prediction;music cognition;melodic expectation;cloze probability
fpsyg.2015.01535,0.02578268876611418,14,543,What goes on in the resting-state? A qualitative glimpse into resting-state experience in the scanner,resting state;descriptive experience sampling (DES);fMRI;default mode network (DMN);Resting State Questionnaire (ReSQ);mind wandering
fpsyg.2014.00355,0.025728987993138937,15,583,Effect of handedness on the occurrence of semantic N400 priming effect in 18- and 24-month-old children,semantic priming;ERPs;N400;handedness;vocabulary;children
fpsyg.2014.00213,0.025423728813559324,15,590,An effect of inhibitory load in children while keeping working memory load constant,executive function;inhibitory control;self-regulation;cognitive control;executive control;spatial Stroop task;Simon task;stimulus-response compatibility
fpsyg.2015.01475,0.025167785234899327,15,596,Chemosensory anxiety cues moderate the experience of social exclusion an fMRI investigation with Cyberball,social exclusion;chemosignals;cyberball;ostracism;olfaction;anxiety
fpsyg.2011.00039,0.024958402662229616,15,601,"Behavioral Assessment of Emotion Discrimination, Emotion Regulation, and Cognitive Control in Childhood, Adolescence, and Adulthood",emotion-regulation;emotion;faces;go/nogo
fpsyg.2015.00013,0.024875621890547265,15,603,The role of audience participation and task relevance on change detection during a card trick,card trick;change blindness;attention;perception;agency;web experiment;magic
fpsyg.2013.00881,0.024778761061946902,14,565,D j vu experiences in healthy subjects are unrelated to laboratory tests of recollection and familiarity for word stimuli,dj vu;memory;recognition;recollection;familiarity
fpsyg.2015.01226,0.02464788732394366,14,568,Brief learning induces a memory bias for arousing-negative words: an fMRI study in high and low trait anxious persons,trait anxiety;fMRI;emotions;memory bias;consolidation;statistical word-learning;amygdala
fpsyg.2016.01028,0.02462121212121212,13,528,Self-Reported Responses to Player Profile Questions Show Consistency with the Use of Complex Attentional Strategies by Expert Horseshoe Pitchers,attentional strategies;attention;mental skills;horseshoe pitching;expertise
fpsyg.2014.00101,0.024344569288389514,13,534,Primed to be inflexible: the influence of set size on cognitive flexibility during childhood,cognitive flexibility;development;priming;executive function;set size;rule representation
fpsyg.2011.00278,0.02422145328719723,14,578,Individual Differences in Heart Rate Variability Predict the Degree of Slowing during Response Inhibition and Initiation in the Presence of Emotional Stimuli,heart rate variability;response inhibition;individual differences;emotion regulation;stop-signal task
fpsyg.2014.00369,0.024074074074074074,13,540,Color associations for days and letters across different languages,cross-modal;synesthesia;color;metaphor;letters;language;days;association
fpsyg.2016.00603,0.023809523809523808,13,546,"Students Achievement Goals, Learning-Related Emotions and Academic Achievement",achievement goal;emotion;boredom;achievement;enjoyment
fpsyg.2013.00675,0.023809523809523808,13,546,Effects of voice on emotional arousal,emotion;music;arousal;perception;gender;aging
fpsyg.2016.00512,0.023769100169779286,14,589,An Investigation of Five Types of Personality Trait Continuity: A Two-Wave Longitudinal Study of Spanish Adolescents from Age 12 to Age 15,personality;development;stability;change;five-factor model
fpsyg.2014.00393,0.023728813559322035,14,590,Interrelationships between negative mood and clinical constructs: a motivational systems approach,anxiety disorders;depression;inflated responsibility;intolerance of uncertainty;negative mood
fpsyg.2013.00690,0.023608768971332208,14,593,Theta brain rhythms index perceptual narrowing in infant speech perception,speech perception;infants;magnetoencephalography;perceptual narrowing;brain rhythms
fpsyg.2015.00744,0.02355072463768116,13,552,Real-time sampling of reasons for hedonic food consumption: further validation of the Palatable Eating Motives Scale,eating in absence of hunger;external factors;motivation;overeating;coping;emotional eating;obesity;stress
fpsyg.2014.00656,0.0234375,12,512,Temporal dynamics of sensorimotor integration in speech perception and production: independent component analysis of EEG data,speech perception;speech production;EEG;mu rhythm;independent component analysis
fpsyg.2015.00690,0.023297491039426525,13,558,"Methylation of NR3C1 is related to maternal PTSD, parenting stress and maternal medial prefrontal cortical activity in response to child separation among mothers with histories of violence exposure",PTSD;glucocorticoid receptor (NR3c1);fMRI;parenting;interpersonal violence;early life stress;epigenetics;methylation
fpsyg.2015.00018,0.023255813953488372,13,559,Individual differences in attention influence perceptual decision making,electroencephalography (EEG);steady-state visual evoked potential (SSVEP);Phase-locking;hierarchical Bayesian modeling;diffusion models;individual differences;perceptual decision making
fpsyg.2014.01239,0.023255813953488372,14,602,Gender and vocal production mode discrimination using the high frequencies for speech and singing,speech perception;acoustics;singing;voice;high-frequency
fpsyg.2015.01818,0.023064250411861616,14,607,Merge in the Human Brain: A Sub-Region Based Functional Investigation in the Left Pars Opercularis,pars opercularis;clusters;syntax;merge;fMRI
fpsyg.2011.00030,0.02304964539007092,13,564,Single-Trial Regression Elucidates the Role of Prefrontal Theta Oscillations in Response Conflict,EEG;oscillations;response conflict;cognitive control;single trial;regression;theta;medial frontal cortex
fpsyg.2013.00691,0.02292768959435626,13,567,Children's processing of emotion in ironic language,verbal irony;eye gaze;empathy;children;speaker intent
fpsyg.2016.00300,0.02276707530647986,13,571,"Listening to the Shepard-Risset Glissando: the Relationship between Emotional Response, Disruption of Equilibrium, and Personality",music;emotion;personality;auditory illusions;Shepard-Risset glissando;equilibrium
fpsyg.2015.01331,0.022727272727272728,13,572,Improving working memory abilities in individuals with Down syndrome: a treatment case study,working memory;short term memory;Down syndrome;training;cognitive intervention
fpsyg.2014.00465,0.022653721682847898,14,618,The effect of attentional load on implicit sequence learning in children and young adults,implicit learning;sequence learning;dual-tasking;children;serial reaction time task
fpsyg.2015.02037,0.022108843537414966,13,588,Humans Integrate Monetary and Liquid Incentives to Motivate Cognitive Task Performance,reward;motivation;cognitive control;reward integration;decision-making;subjective value;primary and secondary incentives
fpsyg.2013.00355,0.022071307300509338,13,589,Delaying gratification depends on social trust,cognitive processes;delay of gratification;decision making;intertemporal choice;social cognition
fpsyg.2013.00168,0.021937842778793418,12,547,Independence of Valence and Reward in Emotional Word Processing: Electrophysiological Evidence,emotion;reward expectancy;word processing;event-related potentials
fpsyg.2015.00394,0.021885521885521887,13,594,"A test of stress, cues, and re-exposure to large wins as potential reinstaters of suboptimal decision making in rats",decision making;suboptimal choice;reinstatement;gambling;animal model;rats
fpsyg.2014.01203,0.021778584392014518,12,551,Native-likeness in second language lexical categorization reflects individual language history and linguistic community norms,lexical categorization;lexical semantics;bilingualism;immersion;language learning
fpsyg.2014.00953,0.021739130434782608,12,552,Statistical learning of a tonal language: the influence of bilingualism and previous linguistic experience,statistical learning;tonal language;bilingualism;word segmentation;artificial language
fpsyg.2012.00223,0.021505376344086023,12,558,Neural Mechanisms of Reading Facial Emotions in Young and Older Adults,emotion;faces;aging;medial prefrontal cortex;amygdala;affective processing;cognitive control
fpsyg.2016.00487,0.021487603305785124,13,605,Subjective Psychological Well-Being in Families with Blind Children: How Can We Improve It?,blind children;anxiety;well-being;job satisfaction;family satisfaction
fpsyg.2015.00576,0.021352313167259787,12,562,Is it the real deal? Perception of virtual characters versus humans: an affective cognitive neuroscience perspective,uncanny valley;virtual characters;naturalistic stimuli;virtual reality;fMRI;emotion perception;action perception;social interaction
fpsyg.2014.00810,0.021172638436482084,13,614,Depression does not affect time perception and time-to-contact estimation,depression;time perception;timed action task;internal clock;verbal time estimation;time production;time reproduction;time-to-contact estimation
fpsyg.2015.01114,0.0210896309314587,12,569,"Testing Theory of Planned Behavior and Neo-Socioanalytic Theory models of trait activity, industriousness, exercise social cognitions, exercise intentions, and physical activity in a representative U.S. sample",personality;social cognition;Theory of Planned Behavior;Neo-Socioanalytic Theory;industriousness;trait activity;physical activity
fpsyg.2016.00226,0.021015761821366025,12,571,Faces with Light Makeup Are Better Recognized than Faces with Heavy Makeup,female faces;makeup;memory;attractiveness;impression
fpsyg.2014.00879,0.02097902097902098,12,572,Putting the Joy in joint attention: affective-gestural synchrony by parents who point for their babies,pointing;smiling;embodied cognition;intersubjectivity;affective -gestural synchrony
fpsyg.2015.00299,0.02097902097902098,12,572,"Absolute and proportional measures of potential markers of rehearsal, and their implications for accounts of its development",rehearsal;proportional scaling;phonological similarity effect;word length effect;development
fpsyg.2014.01536,0.020905923344947737,12,574,Weighty data: importance information influences estimated weight of digital information storage devices,weight;embodiment;importance;digital data;judgment;relevance;metaphor;social cognition
fpsyg.2013.00292,0.020618556701030927,12,582,"On the Acoustics of Emotion in Audio: What Speech, Music, and Sound have in Common",audio signal processing;emotion recognition;feature selection;transfer learning;music perception;sound perception;speech perception
fpsyg.2015.00373,0.020370370370370372,11,540,Heritability of decisions and outcomes of public goods games,public goods game;heritability;twin study;individual differences;behavior genetics;cooperation
fpsyg.2016.01016,0.020202020202020204,12,594,Emerging Executive Functioning and Motor Development in Infants at High and Low Risk for Autism Spectrum Disorder,executive functioning;autism;high-risk;motor skills;working memory;inhibition
fpsyg.2014.00768,0.02010968921389397,11,547,"Conflict adaptation is predicted by the cognitive, but not the affective alexithymia dimension",Alexithymia;cognitive control;conflict adaptation;Simon effect;Gratton effect
fpsyg.2016.00011,0.01990049751243781,12,603,Quantum-Like Bayesian Networks for Modeling Decision Making,Bayesian networks;decision making;quantum probability;quantum cognition;sure thing principle
fpsyg.2016.00107,0.01967799642218247,11,559,"Imitation, Sign Language Skill and the Developmental Ease of Language Understanding (D-ELU) Model",imitation;sign language;manual gesture;representation;development
fpsyg.2013.00140,0.0196078431372549,11,561,Exploring the movement dynamics of deception,deception;non-linear measures;Dynamical Systems Theory;embodiment;recurrence quantification analysis;multiscale entropy analysis;body and facial movements;time series analysis
fpsyg.2013.00603,0.01948051948051948,12,616,Desynchronization and rebound of beta oscillations during conscious and unconscious local neuronal processing in the macaque lateral prefrontal cortex,beta oscillations;control;prefrontal cortex;consciousness
fpsyg.2015.00583,0.019434628975265017,11,566,Influence of being videotaped on the prevalence effect during visual search,visual search;video monitoring;evaluation apprehension;motivation;mere effort;low-prevalence effect;signal detection theory
fpsyg.2016.00534,0.01936619718309859,11,568,What a Smile Means: Contextual Beliefs and Facial Emotion Expressions in a Non-verbal Zero-Sum Game,emotion;beliefs;interpersonal interaction;facial expression;sex;smile
fpsyg.2012.00136,0.01926444833625219,11,571,Spontaneous Body Movements in Spatial Cognition,spatial cognition;motor action;sensorimotor prediction;embodied cognition;mental simulation
fpsyg.2012.00062,0.01926444833625219,11,571,"Binding When and Where Impairs Temporal, but not Spatial Recall in Auditory and Visual Working Memory",automatic encoding;attention;localization;serial order;environmental sound
fpsyg.2014.01538,0.019193857965451054,10,521,Applying how adults rehearse to understand how rehearsal may develop,development of rehearsal;verbal rehearsal;short-term memory;working memory;working memory development
fpsyg.2012.00298,0.01916376306620209,11,574,Neural Mechanisms of Attentional Control Differentiate Trait and State Negative Affect,negative affect;attentional control;prefrontal cortex;emotion;fMRI
fpsyg.2015.00787,0.01916376306620209,11,574,Current insights in the development of children s motor imagery ability,motor imagery;development;children;pediatric rehabilitation;mental rotation;mental chronometry
fpsyg.2013.00857,0.01916376306620209,11,574,"Context, cortex, and associations: a connectionist developmental approach to verbal analogies",analogical reasoning;connectionist models;cognitive development;FTLD;cognitive control;word association
fpsyg.2016.00432,0.01903114186851211,11,578,Emotional Experience and Awareness of Self: Functional MRI Studies of Depersonalization Disorder,depersonalization;insula;interoception;self-awareness;fMRI
fpsyg.2015.00796,0.018739352640545145,11,587,Bilingual children weigh speaker s referential cues and word-learning heuristics differently in different language contexts when interpreting a speaker s intent,mutual exclusivity;bilingualism;code-switching;word-learning;communicative signals;pragmatic cues
fpsyg.2015.00014,0.01841620626151013,10,543,The Trier Social Stress Test as a paradigm to study how people respond to threat in social interactions,Trier Social Stress Test;social-evaluative threat;cortisol;social support;social cognition;social behavior
fpsyg.2015.01388,0.018333333333333333,11,600,"Gender stereotypes across the ages: On-line processing in school-age children, young and older adults",gender stereotypes;on-line language processing;implicit measure;children;young adults;older adults
fpsyg.2016.00782,0.018272425249169437,11,602,Movement Synchrony Forges Social Bonds across Group Divides,children;in-group attitudes;minimal group paradigm;out-group attitudes;prosociality;social bonding;cooperation;movement synchrony
fpsyg.2014.00894,0.01824817518248175,10,548,"What musicians do to induce the sensation of groove in simple and complex melodies, and how listeners perceive it",groove;music;musicians;movement;rhythm;syncopation;micro-timing
fpsyg.2015.00322,0.01824212271973466,11,603,"Grounding context in face processing: color, emotion, and gender",emotion;color;facial expression;gender;implicit affective processing
